name,timestamp,likes,isretweet,isreply,text,retweets,replies
MatterPort,1595969172,4,false,false,"Fully customizable and modular, Happier Camper #travel trailers go where you go and their charming #showroom #virtualtour has us in a #roadtrip mood. Which one would you take on your next adventure? https://t.co/ixWhBkdmYZ https://t.co/rY12gkhXEL",0,0
MatterPort,1595965749,3,false,false,We can't wait to see what you've captured!,0,0
MatterPort,1595955782,1,false,false,"Launched by contemporary art platform Schoeni Projects, the #disCONNECT exhibition is aimed at ""promoting and celebrating cross-cultural exchange."" Check out the #Matterport #virtualtour in @JuxtapozMag.
https://t.co/8rgK0ISZGt",1,0
MatterPort,1595954301,1,false,false,"Coming July 30th: a more responsive, easier-to-use Matterport Dashboard., Learn more here: https://t.co/cFWx1cod3R",0,0
MatterPort,1595898319,3,false,false,"Heads up, new changes coming to space sharing on July 30th, learn more here: https://t.co/b8iBoiFLzM",1,0
MatterPort,1595877317,5,false,false,"https://t.co/CEB1a6DjRc
Discover @MuseuMEAM in #Spain - a living and constantly moving #museum of exhibitions, concerts, theater, painting and sculpture courses, workshops for children. This #virtualtour is full of interesting and thought-provoking #art! https://t.co/i10eoXCHUL",2,0
MatterPort,1595875512,0,false,true,Register now at https://t.co/q5Z2RNJz9w,0,0
MatterPort,1595875493,1,false,false,"In Shop Talk 4, Amir will help you make the right camera choice. Also joining will be Chief Architect, Hakon Erichsen to talk about VR improvements and Guided Tour, and Senior Product Marketing Manager, Elizabeth Fabozzi, who will introduce you to Matterport Capture Services™. https://t.co/afXV7y60aK",0,1
MatterPort,1595867413,0,false,false,Consumers are looking for safe ways to engage and support their favorite local businesses - Matterport and #Google Street View integration is a great way to connect. Take advantage of free Google Street View publishing from now until the end of July https://t.co/5MEIqRpRiv https://t.co/7bxewMcWJ5,0,0
MatterPort,1595785620,4,false,false,"In honor of the @ADANational's 30th Anniversary, we are proud to highlight how our partner, Barnes Creative Studios, has created a streamlined solution to make #Matterport #virtualtours ADA compliant and more handicap accessible. #ADA30
https://t.co/6hVJCMWbj3",0,0
MatterPort,1595779983,3,false,false,"With Matterport, you have a creative way to stay in touch with customers and a powerful tool to ensure safe social distancing guidelines for your space. Take advantage free #Google Street View publishing from now until the end of July https://t.co/5MEIqRpRiv https://t.co/bqLqR037ae",0,0
MatterPort,1595694606,3,false,false,Consumers are looking for safe ways to engage and support their favorite local businesses - Matterport and #Google Street View integration is a great way to connect. Take advantage of free Google Street View publishing from now until the end of July https://t.co/5MEIqRpRiv https://t.co/nSj2TwC3Lw,0,0
MatterPort,1595623922,2,false,false,Punggol is a new town situated on the Tanjong Punggol peninsula in the North-East Region of #Singapore. Take a #virtualtour through a Matterport of a Punggol Field apartment and get a taste of Singaporean living https://t.co/9rLIx53qc6 https://t.co/a4Y16jpXeM,0,0
MatterPort,1595617229,1,false,false,"New technologies must be implemented to market homes today. #Virtualtours have enabled home sales to continue ""with no physical open houses and very limited showings"" according to Ron Costa at @Forbes. 
https://t.co/Ql9jbfzH2w",0,0
MatterPort,1595610034,4,false,false,"Read how the Sharp family was able to use Matterport to sell their self-built home, aid in the construction of their next, and even preserve memories of the home - https://t.co/dnYMsZj76I https://t.co/3P0m5aduZB",0,0
MatterPort,1595607187,1,false,false,"With Matterport, you have a creative way to stay in touch with customers and a powerful tool to ensure safe social distancing guidelines for your space. Take advantage free #Google Street View publishing from now until the end of July https://t.co/5MEIqRpRiv https://t.co/uBlWrfDbq1",1,0
MatterPort,1595530831,2,false,false,"#VRAR takes over the art world as museums and art exhibits remain closed. See how technology is transforming the way we view, experience and think about art. @JebbL @TheArtNewspaper
https://t.co/A3CwJu1sPL",0,0
MatterPort,1595460522,6,false,false,"https://t.co/XIon9GOqPF
The ShifCustom Gallery has a #motorcycle to match every style! Take a #virtualtour through the Art of Motorcycle #showroom and find your favorite ride. https://t.co/wGD7BQP9No",1,2
MatterPort,1595441405,3,false,false,Keep your customers engaged and give them peace of mind by integrating Matterport #virtualtours to #Google street view. Take advantage of free Google Street View publishing until the end of July and have your space listed for life. https://t.co/5MEIqRpRiv https://t.co/cgSodsdrih,0,0
MatterPort,1595436206,0,true,false,RT @SharpLaunch: We're happy to announce a @Matterport virtual tour module integration to support 3D virtual #CRE tours for landlords and b…,2,0
MatterPort,1595430038,1,false,false,"Sign up for our July 30th webinar - The New Normal: Tips &amp; Tricks to Future Proof your Real Estate Business, and learn how to adapt your business and get details on what digital services and initiatives our peers are introducing to keep operations flowing. https://t.co/J480vFc5Rb https://t.co/yuOyyn8oYQ",1,0
MatterPort,1595372135,4,false,false,"Feast your eyes on the stunning #Matterport 3D showroom of @humanscale. Meet Art Director, Denise Figueroa, to learn about their impeccable design philosophy, its mission and history.
https://t.co/d4xyzpe5wS",1,0
MatterPort,1595369652,5,false,false,"https://t.co/zeoDU9pRDO
Happy #BelgianNationalDay! Transport yourself to Bruges, #Belgium and take a #virtualtour through Kasteel van Male - a castle previously occupied by German soldiers in both World Wars, and is still in operation today as a convent for the nuns of St. Trudo. https://t.co/DfiEP1H8qp",2,0
MatterPort,1595278819,3,false,false,"As working from home becomes the 'new normal,' Teddy Menke with @BurnsMcDonnell explores how ""the right technologies and tools can help maintain safe, efficient, and effective teams.""
https://t.co/6L3yOqGByx",2,0
MatterPort,1595271725,2,false,false,"Invented in India in the fifth century, #chess is likely one of the oldest games of our era and is played all around the world. This lovely courtyard would be the perfect place to celebrate #internationalchessday and the 96th anniversary of #FIDE! https://t.co/vVNaEQMAJg",0,1
MatterPort,1595264432,1,false,false,"The future of art is online. @Matt8Eaton at @ABCaustralia dives into the nuances of renowned Brisbane painter William Robinson’s new exhibition featuring a #Matterport #virtualtour
https://t.co/ibtObupTwX",0,0
MatterPort,1595262614,2,false,false,Consumers are looking for safe ways to engage and support their favorite local businesses - Matterport and #Google Street View integration is a great way to connect. Take advantage of free Google Street View publishing from now until the end of July https://t.co/5MEIqRpRiv https://t.co/HYhZXUfe6z,1,1
MatterPort,1595182204,2,false,false,Keep your customers engaged and give them peace of mind by integrating Matterport #virtualtours to #Google street view. Take advantage of free Google Street View publishing until the end of July and have your space listed for life. https://t.co/5MEIqRpRiv https://t.co/8EdBuRvZS2,0,0
MatterPort,1595105711,4,false,false,Happy #NelsonMandela day! Today is about celebrating his achievements in human rights. Take a moment to virtually visit his monument in #SouthAfrica and remember that we all have the ability to have a positive impact on those around us. https://t.co/JOK5Pa1YNQ https://t.co/luby6j69Ta,1,0
MatterPort,1595089806,2,false,false,Consumers are looking for safe ways to engage and support their favorite local businesses - Matterport and #Google Street View integration is a great way to connect. Take advantage of free Google Street View publishing from now until the end of July https://t.co/5MEIqRpRiv https://t.co/ITf3kkceFh,0,0
MatterPort,1595047029,2,false,false,This Matterport of the @Bender_UK Operating Theatre Demo Room offers a unique way to present their #healthcare equipment offerings. Take the #virtualtour to have a peek and learn about Bender's #operatingroom solutions. https://t.co/jEyUv5SDpD https://t.co/USwICseBBI,1,1
MatterPort,1595019617,6,false,false,"For the first time, the Valley of the Kings in Egypt is open to the public virtually with a #Matterport #3D tour. Experience the rich history of this ancient civilization:
https://t.co/dEmQxDa9X7",6,0
MatterPort,1595007011,2,false,false,"While we aren't back to business as usual, @Krisli56207 of the @WiscassetNews believes the #realestate market is looking better as we roll into summer and #3D tours enable potential buyers to view homes safely. https://t.co/9KD6VcZQgA",0,0
MatterPort,1595002389,0,false,false,"With Matterport, you have a creative way to stay in touch with customers and a powerful tool to ensure safe social distancing guidelines for your space. Take advantage free #Google Street View publishing from now until the end of July https://t.co/5MEIqRpRiv https://t.co/BjOt9TPLnF",0,0
MatterPort,1594938557,1,false,false,"Matterport Technician Kielee Kempton with @Titan911AZ goes in-depth with #AdjusterTV's Property IA Show on how #Matterport has streamlined the insurance claims process. Tune in for a full walkthrough as Kielee captures a home using the Matterport Pro2.
https://t.co/5mYUMoooXj",0,1
MatterPort,1594936218,6,false,false,"https://t.co/z1eUyhKJ46
Check out this immersive #onlineshopping experience presented by Rockford #Chile in Providencia - Santiago. Taking the #virtualtour through this Matterport really feels like stepping inside a #boutique! https://t.co/XmZYGl4FOT",1,0
MatterPort,1594926032,1,false,false,"Our CMO @robin_daniels joins CES video blogger @Charbax to walk through #Matterport and our Cortex AI technology, along with the features of our #3D tours – including Mattertags, Measurement Mode and dollhouse view.
https://t.co/z32R4gIPEZ",1,1
MatterPort,1594918888,5,false,false,"Take immersion to the next level by experiencing your #Matterport Space in #virtualreality. Try out our revamped VR Mode optimized for the @oculus  Quest. #MatterportYourSpace
https://t.co/YsSwLZgZYM",2,0
MatterPort,1594851431,1,false,false,Take a #virtualtour of this #Napa #vacationrental without having to leave your seat! All captured with Matterport for #iPhone https://t.co/sk0LeIdKNE https://t.co/fS2YbyAcNm,2,0
MatterPort,1594836604,2,false,false,Keep your customers engaged and give them peace of mind by integrating Matterport #virtualtours to #Google street view. Take advantage of free Google Street View publishing until the end of July and have your space listed for life. https://t.co/5MEIqRpRiv https://t.co/5mKiAJYjrJ,2,0
MatterPort,1594832671,0,false,false,"We are proud to be expanding our value-added reseller program in Canada with @Safetyex. Restoration and disaster response professionals can now utilize Matterport's 3D scanning solutions to provide the most accurate, transparent and fair documentation.
https://t.co/l7cC5PBYUb",0,0
MatterPort,1594825240,0,false,false,Have peace of mind knowing that you have the right tools and knowledge to navigate the rapidly changing industry and join our free July 30th webinar - The New Normal: Tips &amp; Tricks to Future Proof your Real Estate Business. Register today https://t.co/J480vFc5Rb https://t.co/hPAQbJSGli,0,0
MatterPort,1594793654,7,false,false,"https://t.co/Ed4hNyYVJI
For la fête nationale, take an evening #virtual stroll through Gourdon Village captured by @tosolini - Once an armed sentry watching over #France, now a charming mountainside #village and a backdrop for the 2012 film #LeMiserables! 
#LeQuatorzeJuillet https://t.co/PI1ucGJahp",2,0
MatterPort,1594746032,2,false,false,"According to Doug Van Der Weide, ""things are changing fast and those who aren’t looking at changing with the future may not be in business."" @phcppros explains the benefits of capturing its showrooms in #3D.
https://t.co/xxKkiyytH7",1,0
MatterPort,1594688353,5,false,false,"https://t.co/680eTfolpW
A unique space for #dining and drinks, @ubrewingdublin is the first of its kind in Dublin #Ireland. A #virtualtour through their Matterport gives a perfect taste of of their dining experiences and offerings. https://t.co/eD3TyfwNep",1,0
MatterPort,1594685439,1,false,false,"We caught up with @JamesSharp123, founder of the Sharp Real Estate Group, to hear about his successes using #Matterport Capture Services. Read on to learn about his wins @JPRealtors.
https://t.co/vE1YRfjuNl",0,2
MatterPort,1594659631,3,false,false,"Want to enjoy a distillery tour? @Colmanandrews at @DeparturesMag shows how establishments like the @DrinkGlenturret and @sipsmith have created #virtualtours that anyone can see.
https://t.co/QzWbCKEevO",3,1
MatterPort,1594657808,4,false,false,Consumers are looking for safe ways to engage and support their favorite local businesses - Matterport and #Google Street View integration is a great way to connect. Take advantage of free Google Street View publishing from now until the end of July https://t.co/5MEIqRpRiv https://t.co/RYWOmCEOr8,0,0
MatterPort,1594570384,8,false,false,"With Matterport, you have a creative way to stay in touch with customers and a powerful tool to ensure safe social distancing guidelines for your space. Take advantage free #Google Street View publishing from now until the end of July https://t.co/5MEIqRpRiv https://t.co/QiyQHyO8BE",0,0
MatterPort,1594491002,0,false,false,Keep your customers engaged and give them peace of mind by integrating Matterport #virtualtours to #Google street view. Take advantage of free Google Street View publishing until the end of July and have your space listed for life. https://t.co/5MEIqRpRiv https://t.co/YWOmvWz88D,0,0
MatterPort,1594433063,1,false,false,"You were absolutely wonderful to work with, and it's so incredible to see @finalhours come to life! Download Half-Life: Alyx - Final Hours and get immersed in the story of @valvesoftware, including #halflife https://t.co/obcazWd5ZW",1,1
MatterPort,1594410732,1,false,false,"https://t.co/R5HirViQZg
Lanes Group provides 24/7 response to drainage emergencies; maintenance, rehabilitation and renewal; consultancy and waste management. Take a #virtualtour through their amazing new Customer Solution Centre in the #UK, with #Covid19 guidelines in mind. https://t.co/LCYugt1G7n",2,0
MatterPort,1594407895,2,false,false,"Our customer @OnerentCo has been using #Matterport to increase productivity, lease properties faster and even reduce their carbon footprint. Learn how they have saved thousands of hours showing properties and resolving maintenance issues virtually. 
https://t.co/CorrI1DQZC",0,0
MatterPort,1594397589,9,false,false,"With Matterport, you have a creative way to stay in touch with customers and a powerful tool to ensure safe social distancing guidelines for your space. Take advantage free #Google Street View publishing from now until the end of July https://t.co/5MEIqRpRiv https://t.co/MqIRyPUNo3",2,1
MatterPort,1594329362,5,false,false,"While #3D tours have been gaining momentum, ""the onset of COVID-19…turned them from an appealing extra to a necessity in commercial real estate."" The @commobserver outlines the new norms of #realestate
https://t.co/pvD9H90pEa",2,0
MatterPort,1594317919,2,false,false,"https://t.co/lurHxiYzQ5
This Matterport by @CaptureIt3D shows the foundation work for a #SanFrancisco Bay Area home. This scan documents the misplacement of joints, missing nail plates, air pockets in the concrete, and other #construction problems. https://t.co/xkw1M90bO3",1,1
MatterPort,1594306843,2,false,false,"If you're looking to become more agile and responsive in our rapidly-changing profession, check out our blog and register for our July 30th webinar - The New Normal: hints &amp; tips to help you future proof your real estate operation. https://t.co/hSDE3If9ER https://t.co/qngyecSsyq",0,0
MatterPort,1594246569,4,false,false,"Built in 1901, the Alexandra #theatre has been a valuable contributor to arts and culture within #BirminghamUK, presenting first-rate #musicals, drama, comedy and more. Put on your favorite show tunes and have a look around this stunning Matterport! https://t.co/nIna0b5IcV https://t.co/GHAhWjQwtP",0,1
MatterPort,1594160590,4,false,false,"Step outside of the box and into a Skydome -  #home of the future: twice as strong, twice as energy efficient, and featuring a massive internal space with no load-bearing walls. Take a #virtualtour through a Matterport of an earlier prototype https://t.co/UZyoYEms5s https://t.co/aogbToaPme",1,0
MatterPort,1594155661,4,false,false,"Our director of product marketing, Volkie Yelkovan, explains how #realestate pros are adopting #Matterport #virtualtours that make ""you feel like you are in a property without being there” @acmwphoto @dailycamera
https://t.co/XtIRGPI7h1",0,1
MatterPort,1594148408,2,false,false,"Take a moment to immerse yourself in the place that Dr. Martin Luther King Jr. honed his oratory. We took a moment with @DanSmigrod at @We_Get_Around to learn what it was like to capture the space in 3D. 
https://t.co/AFk5A5OohK",0,0
MatterPort,1594083009,9,false,false,"https://t.co/JZ1oL50KL1 Take a #virtualtour through a beloved #SF landmark - The Palace of Fine Arts was at the heart of the Panama-Pacific Exhibition, and a symbol of the city's determination to rise above the ashes left from the tragedies of the 1906 earthquake. https://t.co/XFN1IhukbI",3,0
MatterPort,1594071251,2,false,false,"You have been such and amazing partner, and it's been a thrill being apart of Season 1. Looking forward to working on Season 2 together!",0,0
MatterPort,1594069229,0,false,false,"https://t.co/K0cDuHDhRW
Register for the next Shop Talk happening on July 8, 2020. Learn the difference between active and inactive spaces, how collaborators can upload scans, archiving spaces, and choosing the most suitable plan based on your capture method. https://t.co/9aJKNjELH7",0,0
MatterPort,1594064565,1,false,false,"A brief maintenance will be performed on our production database on Thursday 7/9, starting at 7pm PST. There will be a short disruption in service (&lt; 1 minute) while services failover. We don't anticipate any disruption in space processing.",0,0
MatterPort,1594054832,0,false,false,"While the digitization of art and culture may have been not top of mind, the shuttering of museums has led to greater digital preservation cultural heritage. Read Friederike Voigt's article in @redshift3d:  https://t.co/ShmVil2f5W",1,0
MatterPort,1593898510,4,false,false,"https://t.co/DiP5alKUzZ
Happy #4thofJuly! Hop aboard ""Air Force One"", the first presidential #jetplane - a custom #Boeing 707-120. The plane was first used in 1959 by #PresidentEisenhower and is a flying Oval Office with modified interior and sophisticated communication equipment https://t.co/KguFmCpIs5",0,0
MatterPort,1593792615,3,false,false,"https://t.co/p2LAKZ4aan 
Alexander Hamilton was one of the founding fathers of the United States, as well as the founder of the @NYPost! That's one heck of a resume. Transport yourself to Manhattan, #NY and visit his grave this #4thofJuly weekend. https://t.co/igG2CUfAjZ",0,0
MatterPort,1593727323,5,false,false,"What a view to wake up to! Captured with an #iPhone 8, this outdoor #garden would be a perfect place to unplug and unwind. What are you growing in your garden? Download Matterport for iPhone and nominate your space here: https://t.co/Qto8wowAfs https://t.co/WU9pIUDBR4",1,0
MatterPort,1593709235,2,false,false,"Kendra Sipes, a broker with The Knell Group of @coldwellbanker Real Estate Group, says ""virtual tours...are an additional service to the seller. They don’t have so many people coming through their houses."" @LeeRaye77 @ILREALTOR
https://t.co/gGfEVKGwdj",0,0
MatterPort,1593640870,2,false,false,"https://t.co/X5GuJxf8qr
Happy #CanadaDay! On July 1, 2017, the MV Polar Prince embarked on an epic 150-day sailing expedition from Toronto to Victoria, celebrating 150 years of confederation. Explore the ship and learn about its journey. https://t.co/xvmlvlxISq",1,0
MatterPort,1593626508,4,false,false,"Virtually welcome your customers to your business by putting it on the map with Matterport + @Google Street View. Publish your #Matterport spaces on GSV for life by listing them for free through July 31.
https://t.co/zUEnUz25Q2",0,0
MatterPort,1593626462,3,false,false,"Happy #CanadaDay! Nestled in the heart of #Toronto, @artagallery is an important cultural and artistic center with a vision to promote #art in our lives and make talented artists accessible to the community. Check out the incredible work in this Matterport https://t.co/4ZDSvSRvLj https://t.co/jK0fGUzHsv",0,0
MatterPort,1593612821,0,false,true,"Brands like @CushWake, @JLL, @Colliers and @EngelVoelkersHQ look to accelerate sales and tenancy by enabling clients to explore and interact with properties from anywhere, anytime. https://t.co/v7XJG56fM6",0,0
MatterPort,1593612739,1,false,false,Matterport Capture Services is here to help global and regional enterprises quickly scale its portfolio of 3D virtual tours with our Capture Technician network. https://t.co/v7XJG56fM6 https://t.co/CH4tEXv85T,1,1
MatterPort,1593609981,0,false,true,"Brands like @CushWake, @JLL, @Colliers and @EngelVoelkersHQ look to accelerate sales and tenancy by enabling clients to explore and interact with properties from anywhere, anytime. https://t.co/v7XJG56fM6",0,0
MatterPort,1593551462,0,false,false,"https://t.co/q5Z2RO1ay6
Register for the next Shop Talk on July 8, 2020. Learn the difference between active and inactive spaces, how collaborators can upload scans, archiving spaces, and choosing the most suitable plan based on your capture method. https://t.co/vEnY3WIY7g",0,0
MatterPort,1593540048,1,false,false,"https://t.co/ovFwkLjYP1
Wander galleries of @BlenheimPalace in Woodstock, Oxfordshire - the birthplace of Sir Winston Churchill. Instantly transport yourself to South East England and get a glimpse of his life through this Matterport #virtualtour. https://t.co/9CT33crKPF",2,0
MatterPort,1593536441,1,false,false,"OrangeTee in Singapore has been using the #Matterport platform to streamline its showing practices: clients are using #virtualtours to narrow down the properties they truly love before an in-person viewing.
https://t.co/VQ1MRkcPwY",1,0
MatterPort,1593478263,1,false,false,"https://t.co/saVbT4wMvB
Named after the head fisherman of mythical little people (the Menehune), #Maniniholo Dry Cave located on Kauai’s north shore is across from Ha’ena Beach Park in #Hawaii. Take the #virtualtour this unique Matterport
#InternationalDayOfTheTropics https://t.co/57i6kCpMgP",0,0
MatterPort,1593460936,3,false,false,"https://t.co/57H3Ih46aH
Celebrate #InternationalDayOfTheTropics by revisiting Casita Verde. Take the interactive #vitualtour through this Matterport and learn about why biodiversity is important, and what small changes we can make in our daily lives to help protect it. https://t.co/HHvjKSl809",0,0
MatterPort,1593450031,1,false,false,"Our director of product marketing, Volkie Yelkovan, spoke with @HoldenL at @NerdWallet about how #3D #virtual property tours work, explaining how ""It's almost like you are there.""
https://t.co/GHU1gOgmsk",0,1
MatterPort,1593351792,0,false,false,"Transport yourself to the center of Krakow, #Poland and enter @ShineClubKrakow - modern, spacious, and a visual wonderland! Put on your favorite jams and #dance your way across this Matterport https://t.co/hj3ytTdacK
#virtualtour #matterportyourspace https://t.co/sKsImXt04M",0,0
MatterPort,1593293830,2,false,false,"The Study in Minneapolis, Minnesota is a coworking space which caters to entrepreneurs and independent business owners. Take the #virtualtour and check out the game room! https://t.co/FeRUbPZe5j https://t.co/jheDng5Hw3",1,0
MatterPort,1593196980,2,false,true,"Is there a space in your community that symbolizes peace, freedom, and equality? Share the name and location in the comments.",1,0
MatterPort,1593196568,4,false,false,"Captured with Matterport for #iPhone, this tribute to #AfricanAmerican Olympians Tommie Smith and John Carlos stands proudly on the campus of their alma mater, @SJSU. Take a moment and visit the monument here https://t.co/JZlM1N7lAa https://t.co/SG3DeQBJOD",1,1
MatterPort,1593190983,1,false,false,"Introducing our new VAR partners Matter Software, @maximumsolution and Vistandard to outfit #realestate, #AEC and #VR professionals with #Matterport's #3D scanning solutions in APAC and EMEA
https://t.co/Yj959QtVDt",2,0
MatterPort,1593190847,0,false,false,"Curious how top real estate pros close the deal? @BostonMagazine profiles the Greater Boston area's rockstar agents and the must-knows on buying and selling #realestate during a pandemic. 
https://t.co/oVgMzZ3nDS",0,0
MatterPort,1593123148,2,false,false,Climb aboard this #boat with all the comforts of a home! The Hoxton by @NewandUsedBoatCo stands out from the pack offering all the traditions of canal life with cutting edge interior design. Check out the Matterport https://t.co/OiDCTTnOpM https://t.co/jsDZyi3qAH,1,1
MatterPort,1593108673,2,false,false,"Today is the annual #dayoftheseafarer, and we are recognizing that #SeafarersAreKeyWorkers. Thank you for your sacrifices, dedication, and hard work! Take a #virtualtour of the Endurance III cargo ship https://t.co/7lnXJmTcWa https://t.co/RSAtriiQ4a",1,0
