name,timestamp,likes,isretweet,isreply,text,retweets,replies
MarlowCano,1614171643,3,false,false,"My child attends a Public Charter School, and we love it! The school has been incredible. @BrowardSchools Please keep prioritizing all Broward students! #SchoolChoiceMatters #SchoolChoiceParent",0,1
MarlowCano,1607964529,0,false,false,"Tu cuerpo es tu compañero para toda la vida. Trátalo bien, escúchalo y cuídalo. 
#FelizLunes #CanoHealth",0,0
MarlowCano,1604335098,1,false,false,"Todos ponemos nuestra “gota” de amor, esfuerzo, trabajo, sacrificios...por eso cada uno de nosotros es importante. Y es la razón por lo que cada persona suma a nuestra vida personal y profesional y a nuestro entorno! 

Buen inicio de semana para todos! 

#FelizLunes #HappyMonday https://t.co/fPE0rmSe3w",0,0
MarlowCano,1601861881,0,true,false,"RT @UniNoticias: El Dr. @MarlowCano explica que el presidente Trump, además de antivirales y Remdesivir, está recibiendo dosis de Dexametas…",18,0
MarlowCano,1588433143,4,false,false,Lo nuevo que sabemos del #COVID19 y cómo protegernos en estos tiempos de reapertura. Una entrevista este domingo a las 11:00 am en #AlPuntoFL @univision23,0,0
MarlowCano,1587783839,2,false,false,Very proud to have coauthored this article. Early and individualized care of patients with COVID-19 can save lives.  https://t.co/dmOD7ZcV1D,0,0
MarlowCano,1587655004,3,false,false,"This study https://t.co/625R0GSpIn proves what we have been saying, regular surgical masks do NOT protect against #COVID19 . However, we still recommend the public use of masks because at the very least raises awarenesses. 👇 https://t.co/n00w9VkMF9",0,0
MarlowCano,1587394808,3,false,false,"Remdesivir es un medicamento experimental que se ha probado en varios pacientes con #COVID19, y los resultados han sido esperanzadores.
#TogetherAgainstCoronavirus #FightingTogether https://t.co/bilJRuIfTL",0,0
